{"command":"makedevs","version":"v1.2.5","schemaVersion":"1.0","exitCode":0,"data":{"table":"/tmp/goposix-golden.cVsPf3/devtable.txt","rootdir":"/tmp/goposix-golden.cVsPf3/md-root","created":[{"name":"devname","type":"c","mode":"600","uid":0,"gid":0,"major":1,"minor":3,"status":"failed","error":"operation not permitted"}],"failedCount":1},"error":null}
